{
  "benchmark_version": "0.1",
  "category": "ai-provenance",
  "domain": "generic",
  "expected": {
    "reason_codes": [],
    "status": "admitted"
  },
  "id": "AVB-AIPROV-001",
  "input": {
    "manifest": {
      "agent_interoperability": {
        "delegation_records": [],
        "tool_records": [],
        "untrusted_context_enforced": null
      },
      "agent_runtime": {
        "agent_framework": "framework",
        "agent_name": "agent-name",
        "confidence": "declared",
        "execution_environment": "local"
      },
      "agile_v_skills": [],
      "aibom_schema_version": "0.2",
      "artifact_influence": [],
      "context": {
        "declared": {
          "datasets": [],
          "instruction_bundles": [],
          "policies": [],
          "sources": []
        },
        "observed": {
          "confidence": "declared",
          "policy_decisions_evidence": "",
          "sources": [],
          "tool_calls_evidence": ""
        }
      },
      "hashes": [],
      "identity": {
        "branch": "main",
        "commit_sha": "abc123",
        "created_at": "2026-10-01T00:00:00Z",
        "created_by": "test-agent",
        "repository": "test/repo",
        "run_id": "RUN-0001",
        "task_id": "AAV-0001"
      },
      "manifest_type": "agile-v-agent-run-bom",
      "models": [
        {
          "confidence": "declared",
          "evidence_locator": "session metadata",
          "model_id": "test-model-1",
          "model_version": "A",
          "name": "test-model",
          "provider": "test-provider"
        }
      ],
      "risk": {
        "agile_v_risk_level": "L2",
        "ai_influence_level": "assistive",
        "human_approval_required": false,
        "regulated_context": false
      },
      "security_and_privacy": {
        "hidden_chain_of_thought_excluded": true,
        "pii_redacted": true,
        "prompt_capture_policy": "metadata_only",
        "secrets_redacted": true
      },
      "summary": {
        "human_approval": "not_required",
        "unresolved_items": [],
        "verifier_notes": ""
      },
      "tools": []
    }
  },
  "operation": "ai_run_manifest",
  "tags": [],
  "title": "AI Run Manifest with declared identities",
  "trusted": {
    "sources": {}
  }
}
