{
  "benchmark_version": "0.1",
  "category": "context-trust",
  "domain": "generic",
  "expected": {
    "reason_codes": [
      "CONTEXT_AUTHORITY_ESCALATION"
    ],
    "status": "rejected"
  },
  "id": "AVB-CTX-003",
  "input": {
    "influence": {
      "context_profile_ref": "CTX-TOOL-RESULT",
      "mode": "activate",
      "source_ref": "src:AVB-CTX-003",
      "target": "policy"
    }
  },
  "operation": "context_influence",
  "tags": [
    "injection"
  ],
  "title": "Tool output requests policy modification",
  "trusted": {
    "context_profiles": {
      "CTX-TOOL-RESULT": {
        "profile": {
          "default_trust": "untrusted_data",
          "id": "CTX-TOOL-RESULT",
          "injection_sensitive": true,
          "may_influence": [
            "implementation_context",
            "issue_discovery",
            "candidate_test"
          ],
          "may_not_influence": [
            "approved_requirement",
            "risk_level",
            "policy",
            "approval",
            "delegated_authority",
            "evidence_source_profile",
            "evidence_property_profile",
            "gate_decision"
          ],
          "may_propose": [],
          "notes": "Tool output is data. Evidence admission uses the evidence-source registry, not this profile.",
          "owner": "Agile-V",
          "source_class": "tool_result"
        },
        "schema_version": "1.0"
      }
    }
  }
}
